[I 2024-12-27 06:55:21,688] Trial 49 finished with value: 0.7427283146246471 and parameters: {'tree_method': 'hist', 'booster': 'gbtree', 'max_depth': 7, 'learning_rate': 0.027939706284187984, 'n_estimators': 351, 'subsample': 0.7931828935397385, 'colsample_bytree': 0.9822660507813663, 'reg_alpha': 0.0010074108527172404, 'reg_lambda': 1.5853602895162307e-05, 'gamma': 8.070848562701166e-07}. Best is trial 35 with value: 0.6844660767041489.
[I 2024-12-27 06:55:25,080] Trial 50 finished with value: 0.7157401910742004 and parameters: {'tree_method': 'hist', 'booster': 'gbtree', 'max_depth': 8, 'learning_rate': 0.0378208336935128, 'n_estimators': 200, 'subsample': 0.6015512447622335, 'colsample_bytree': 0.6456639883617855, 'reg_alpha': 0.004720608245208495, 'reg_lambda': 0.0009245311352569261, 'gamma': 0.04352893244223454}. Best is trial 35 with value: 0.6844660767041489.
[I 2024-12-27 06:55:27,941] Trial 51 finished with value: 0.689581195724257 and parameters: {'tree_method': 'hist', 'booster': 'gbtree', 'max_depth': 10, 'learning_rate': 0.02038738853570105, 'n_estimators': 162, 'subsample': 0.6487303414827505, 'colsample_bytree': 0.8677016180802668, 'reg_alpha': 0.1917991695921661, 'reg_lambda': 9.795452266903842e-07, 'gamma': 0.8986405950025479}. Best is trial 35 with value: 0.6844660767041489.
[I 2024-12-27 06:55:34,856] Trial 52 finished with value: 0.7089738982412697 and parameters: {'tree_method': 'hist', 'booster': 'gbtree', 'max_depth': 10, 'learning_rate': 0.020476511707719098, 'n_estimators': 301, 'subsample': 0.6521066823684116, 'colsample_bytree': 0.9528287419937727, 'reg_alpha': 0.9827821553632304, 'reg_lambda': 8.985902744615478e-07, 'gamma': 0.16558249101255054}. Best is trial 35 with value: 0.6844660767041489.
[I 2024-12-27 06:55:37,837] Trial 53 finished with value: 0.6951178565425679 and parameters: {'tree_method': 'hist', 'booster': 'gbtree', 'max_depth': 9, 'learning_rate': 0.030668081007171263, 'n_estimators': 133, 'subsample': 0.5794433511528474, 'colsample_bytree': 0.9981276469714192, 'reg_alpha': 0.01254261222019979, 'reg_lambda': 0.14662486011218537, 'gamma': 0.42860808803259903}. Best is trial 35 with value: 0.6844660767041489.
[I 2024-12-27 06:55:40,801] Trial 54 finished with value: 0.6933570388483126 and parameters: {'tree_method': 'hist', 'booster': 'gbtree', 'max_depth': 9, 'learning_rate': 0.0330175613254324, 'n_estimators': 128, 'subsample': 0.5775752147799514, 'colsample_bytree': 0.999893520670809, 'reg_alpha': 0.008806080950424375, 'reg_lambda': 0.17474817902180684, 'gamma': 0.4064157981451904}. Best is trial 35 with value: 0.6844660767041489.
[I 2024-12-27 06:55:43,427] Trial 55 finished with value: 0.6951416937560305 and parameters: {'tree_method': 'hist', 'booster': 'gbtree', 'max_depth': 9, 'learning_rate': 0.033627750431849485, 'n_estimators': 135, 'subsample': 0.5756054550979429, 'colsample_bytree': 0.6968761448022192, 'reg_alpha': 0.009743407519110986, 'reg_lambda': 0.09549158611576064, 'gamma': 0.3893459943821834}. Best is trial 35 with value: 0.6844660767041489.
[I 2024-12-27 06:55:47,262] Trial 56 finished with value: 0.6906258730634053 and parameters: {'tree_method': 'hist', 'booster': 'gbtree', 'max_depth': 8, 'learning_rate': 0.022344436511661257, 'n_estimators': 192, 'subsample': 0.5323967459961967, 'colsample_bytree': 0.9504292372280936, 'reg_alpha': 0.04547553978101736, 'reg_lambda': 0.023458835998093727, 'gamma': 0.10941731271348934}. Best is trial 35 with value: 0.6844660767041489.
[I 2024-12-27 06:55:48,590] Trial 57 finished with value: 0.6694374542529933 and parameters: {'tree_method': 'hist', 'booster': 'gbtree', 'max_depth': 3, 'learning_rate': 0.02131476462502049, 'n_estimators': 190, 'subsample': 0.5208214948450266, 'colsample_bytree': 0.9026225593066971, 'reg_alpha': 0.04432840551283495, 'reg_lambda': 0.028370900052364784, 'gamma': 0.0032576276143252963}. Best is trial 57 with value: 0.6694374542529933.
[I 2024-12-27 06:55:49,975] Trial 58 finished with value: 0.6686783695877413 and parameters: {'tree_method': 'hist', 'booster': 'gbtree', 'max_depth': 3, 'learning_rate': 0.021245647473126215, 'n_estimators': 192, 'subsample': 0.52344986876236, 'colsample_bytree': 0.9293950989585893, 'reg_alpha': 0.04942732386141808, 'reg_lambda': 0.8393636825980653, 'gamma': 0.0016128226193114076}. Best is trial 58 with value: 0.6686783695877413.
[I 2024-12-27 06:55:51,433] Trial 59 finished with value: 0.6863708258799501 and parameters: {'tree_method': 'hist', 'booster': 'gbtree', 'max_depth': 3, 'learning_rate': 0.012143111590841102, 'n_estimators': 201, 'subsample': 0.5124566137645807, 'colsample_bytree': 0.8974522042624709, 'reg_alpha': 0.12361061270597481, 'reg_lambda': 0.02473899639468019, 'gamma': 0.0019388591911493741}. Best is trial 58 with value: 0.6686783695877413.
[I 2024-12-27 06:55:52,864] Trial 60 finished with value: 0.6912984052416871 and parameters: {'tree_method': 'hist', 'booster': 'gbtree', 'max_depth': 3, 'learning_rate': 0.012301748817579167, 'n_estimators': 236, 'subsample': 0.5045175793352833, 'colsample_bytree': 0.51189426182564, 'reg_alpha': 0.13809063459829718, 'reg_lambda': 0.6593973294158562, 'gamma': 0.00034646844995615367}. Best is trial 58 with value: 0.6686783695877413.
[I 2024-12-27 06:55:54,265] Trial 61 finished with value: 0.6763395296608584 and parameters: {'tree_method': 'hist', 'booster': 'gbtree', 'max_depth': 3, 'learning_rate': 0.014806312224923008, 'n_estimators': 196, 'subsample': 0.5283420437123364, 'colsample_bytree': 0.8997488481154732, 'reg_alpha': 0.05639813706006281, 'reg_lambda': 0.008012973237292472, 'gamma': 0.0009400673755633863}. Best is trial 58 with value: 0.6686783695877413.
[I 2024-12-27 06:55:55,573] Trial 62 finished with value: 0.6783227432842789 and parameters: {'tree_method': 'hist', 'booster': 'gbtree', 'max_depth': 3, 'learning_rate': 0.015292410360625324, 'n_estimators': 188, 'subsample': 0.5263509542851528, 'colsample_bytree': 0.8693885082492206, 'reg_alpha': 0.058530390820979175, 'reg_lambda': 0.010272270576987355, 'gamma': 0.0022855920347231934}. Best is trial 58 with value: 0.6686783695877413.
[I 2024-12-27 06:56:00,866] Trial 63 finished with value: 0.6762824973841163 and parameters: {'tree_method': 'hist', 'booster': 'gbtree', 'max_depth': 3, 'learning_rate': 0.010209997974295693, 'n_estimators': 914, 'subsample': 0.5230998260370235, 'colsample_bytree': 0.8735601694261931, 'reg_alpha': 0.06116176938756129, 'reg_lambda': 0.004977253164664897, 'gamma': 0.0026277062199396217}. Best is trial 58 with value: 0.6686783695877413.
[I 2024-12-27 06:56:05,797] Trial 64 finished with value: 0.6766473823892769 and parameters: {'tree_method': 'hist', 'booster': 'gbtree', 'max_depth': 3, 'learning_rate': 0.011123101545864725, 'n_estimators': 852, 'subsample': 0.5368535200773518, 'colsample_bytree': 0.8990673063820208, 'reg_alpha': 0.023681717002805764, 'reg_lambda': 0.004911424851618115, 'gamma': 0.0025107495650512433}. Best is trial 58 with value: 0.6686783695877413.
[I 2024-12-27 06:56:12,775] Trial 65 finished with value: 0.7013658987738555 and parameters: {'tree_method': 'hist', 'booster': 'gbtree', 'max_depth': 4, 'learning_rate': 0.015119044566384172, 'n_estimators': 929, 'subsample': 0.5355762964047659, 'colsample_bytree': 0.8775140801930972, 'reg_alpha': 0.03037085822994, 'reg_lambda': 0.006694412052412136, 'gamma': 0.003334972817621348}. Best is trial 58 with value: 0.6686783695877413.
[I 2024-12-27 06:56:17,926] Trial 66 finished with value: 0.6772472112249011 and parameters: {'tree_method': 'hist', 'booster': 'gbtree', 'max_depth': 3, 'learning_rate': 0.010824392106588743, 'n_estimators': 903, 'subsample': 0.5343248925113079, 'colsample_bytree': 0.9221270725913411, 'reg_alpha': 0.062393941425290665, 'reg_lambda': 0.0023976217595311294, 'gamma': 0.0008304593196699603}. Best is trial 58 with value: 0.6686783695877413.
[I 2024-12-27 06:56:23,259] Trial 67 finished with value: 0.6749266908793659 and parameters: {'tree_method': 'hist', 'booster': 'gbtree', 'max_depth': 3, 'learning_rate': 0.010058111507607723, 'n_estimators': 914, 'subsample': 0.5292743715762551, 'colsample_bytree': 0.8274785194601316, 'reg_alpha': 0.05763647854810495, 'reg_lambda': 0.002082438455365246, 'gamma': 0.001149920088298887}. Best is trial 58 with value: 0.6686783695877413.
[I 2024-12-27 06:56:29,848] Trial 68 finished with value: 0.6868149935473293 and parameters: {'tree_method': 'hist', 'booster': 'gbtree', 'max_depth': 4, 'learning_rate': 0.010283179922577188, 'n_estimators': 891, 'subsample': 0.5545007070469292, 'colsample_bytree': 0.9238950162708712, 'reg_alpha': 0.01855945360010128, 'reg_lambda': 0.0017385450861385659, 'gamma': 0.0009366613131593658}. Best is trial 58 with value: 0.6686783695877413.
[I 2024-12-27 06:56:34,475] Trial 69 finished with value: 0.6753636548888802 and parameters: {'tree_method': 'hist', 'booster': 'gbtree', 'max_depth': 3, 'learning_rate': 0.01113216758757356, 'n_estimators': 791, 'subsample': 0.5226921907289434, 'colsample_bytree': 0.9015284066523789, 'reg_alpha': 0.03004892159423486, 'reg_lambda': 0.0025274336018284234, 'gamma': 0.00018398102085225403}. Best is trial 58 with value: 0.6686783695877413.
[I 2024-12-27 06:56:39,099] Trial 70 finished with value: 0.6793012214395793 and parameters: {'tree_method': 'hist', 'booster': 'gbtree', 'max_depth': 3, 'learning_rate': 0.013365121542968003, 'n_estimators': 795, 'subsample': 0.568645443352164, 'colsample_bytree': 0.8306076335193986, 'reg_alpha': 0.024952761040947905, 'reg_lambda': 0.05555629469471571, 'gamma': 0.00019544204550380116}. Best is trial 58 with value: 0.6686783695877413.
[I 2024-12-27 06:56:44,056] Trial 71 finished with value: 0.6770559819650126 and parameters: {'tree_method': 'hist', 'booster': 'gbtree', 'max_depth': 3, 'learning_rate': 0.010908055163101274, 'n_estimators': 861, 'subsample': 0.5186704828262115, 'colsample_bytree': 0.9015104453197345, 'reg_alpha': 0.08891468966293649, 'reg_lambda': 0.002716310000659773, 'gamma': 0.0005358306701709609}. Best is trial 58 with value: 0.6686783695877413.
[I 2024-12-27 06:56:49,006] Trial 72 finished with value: 0.6769252410676263 and parameters: {'tree_method': 'hist', 'booster': 'gbtree', 'max_depth': 3, 'learning_rate': 0.011198894025533236, 'n_estimators': 848, 'subsample': 0.5188750719087832, 'colsample_bytree': 0.9023630958998611, 'reg_alpha': 0.08322741835667864, 'reg_lambda': 0.0028265069404014268, 'gamma': 6.432831361971308e-05}. Best is trial 58 with value: 0.6686783695877413.
[I 2024-12-27 06:56:54,288] Trial 73 finished with value: 0.6870039369023128 and parameters: {'tree_method': 'hist', 'booster': 'gbtree', 'max_depth': 4, 'learning_rate': 0.013556206590421649, 'n_estimators': 696, 'subsample': 0.5517670871708262, 'colsample_bytree': 0.8857633987602543, 'reg_alpha': 0.04633509420378643, 'reg_lambda': 0.007141967372590875, 'gamma': 5.5813426064698905e-05}. Best is trial 58 with value: 0.6686783695877413.
[I 2024-12-27 06:56:59,059] Trial 74 finished with value: 0.676658916963181 and parameters: {'tree_method': 'hist', 'booster': 'gbtree', 'max_depth': 3, 'learning_rate': 0.011455035089511486, 'n_estimators': 824, 'subsample': 0.5469181107182816, 'colsample_bytree': 0.9065102870719004, 'reg_alpha': 0.012571183878616407, 'reg_lambda': 0.014535681415481689, 'gamma': 0.008940070227123028}. Best is trial 58 with value: 0.6686783695877413.
Best hyperparameters: {'tree_method': 'hist', 'booster': 'gbtree', 'max_depth': 3, 'learning_rate': 0.021245647473126215, 'n_estimators': 192, 'subsample': 0.52344986876236, 'colsample_bytree': 0.9293950989585893, 'reg_alpha': 0.04942732386141808, 'reg_lambda': 0.8393636825980653, 'gamma': 0.0016128226193114076}
Log Loss on test set: 0.7230005878415613
Accuracy on test set: 0.7054794520547946
Model saved as model.json
        Win      Draw      Loss
0  0.333839  0.030176  0.635985
1  0.912461  0.016385  0.071154
2  0.343379  0.031586  0.625035
3  0.566960  0.028001  0.405039
4  0.063286  0.015270  0.921444

(process:5600): Gtk-WARNING **: 06:56:59.279: Theme directory actions/24 of theme Dracula has no size field


(process:5600): Gtk-WARNING **: 06:56:59.279: Theme directory actions/32 of theme Dracula has no size field


(process:5600): Gtk-WARNING **: 06:56:59.279: Theme directory actions/16@2x of theme Dracula has no size field


(process:5600): Gtk-WARNING **: 06:56:59.279: Theme directory actions/22@2x of theme Dracula has no size field


(process:5600): Gtk-WARNING **: 06:56:59.279: Theme directory actions/24@2x of theme Dracula has no size field


(process:5600): Gtk-WARNING **: 06:56:59.279: Theme directory actions/32@2x of theme Dracula has no size field


(process:5600): Gtk-WARNING **: 06:56:59.279: Theme directory actions/symbolic of theme Dracula has no size field


(process:5600): Gtk-WARNING **: 06:56:59.279: Theme parser error: gtk.css:2705:14-18: Negative values are not allowed

(process:5600): Gtk-WARNING **: 06:56:59.283: Theme parser error: gtk.css:5627:3-9: No property named "height"
/home/cosmos/.local/lib/python3.10/site-packages/sklearn/metrics/_classification.py:1531: UndefinedMetricWarning: Precision is ill-defined and being set to 0.0 in labels with no predicted samples. Use `zero_division` parameter to control this behavior.
  _warn_prf(average, modifier, f"{metric.capitalize()} is", len(result))
/home/cosmos/.local/lib/python3.10/site-packages/sklearn/metrics/_classification.py:1531: UndefinedMetricWarning: Precision is ill-defined and being set to 0.0 in labels with no predicted samples. Use `zero_division` parameter to control this behavior.
  _warn_prf(average, modifier, f"{metric.capitalize()} is", len(result))
/home/cosmos/.local/lib/python3.10/site-packages/sklearn/metrics/_classification.py:1531: UndefinedMetricWarning: Precision is ill-defined and being set to 0.0 in labels with no predicted samples. Use `zero_division` parameter to control this behavior.
  _warn_prf(average, modifier, f"{metric.capitalize()} is", len(result))
              precision    recall  f1-score   support

         Win       0.68      0.79      0.73       141
        Draw       0.00      0.00      0.00        16
        Loss       0.73      0.70      0.71       135

    accuracy                           0.71       292
   macro avg       0.47      0.50      0.48       292
weighted avg       0.67      0.71      0.69       292

End time: 2024-12-27 06:57:00.980309
cosmos@cosmos:~/eclipse-workspace/ChessAnalytics$ 